No,Tanggal SK Pembimbing,Tanggal SK Penguji,Tanggal Sidang /Lulus ,NIM,Mahasiswa,Judul ,Pembimbing 1,Pembimbing 2,Penguji 1,Penguji 2
13,2020-08-27,,,171221094,YOSI SAPUTRA,Rancang Bangun Sistem Informasi Peramalan Penjualan Menggunakan Metode Single Exponential Smoothing Berbasis Web (Studi Kasus : Sikattjhons Store),"Rachmat Wahid Saleh Insani, S.Kom., M.Cs","Yulrio Brianorman, S.SI., M.T","Sucipto, M.Kom","Syf Putri Agustini Alkadri, S.T., M.Kom"
22,2021-01-05,,,171221102,LIOVAN AJI AIRLANGGA,RANCANG BANGUN SISTEM PELAYANAN PUBLIK PADA DINAS PEKERJAAN UMUM DAN PENATAAN RUANG PROVINSI KALIMANTAN BARAT MENGGUNAKAN METODE CUSTOMER SATISFACTION INDEX (CSI) SEBAGAI PENILIAN KEPUASAN PENGGUNA JASA,"Rachmat Wahid Saleh Insani, S.Kom., M.Cs","Yulrio Brianorman, S.SI., M.T","Syf Putri Agustini Alkadri, S.T., M.Kom","Asrul Abdullah, S.Kom., M.Cs"
28,2021-03-22,,,171220818,Pera,TES WATCH (TURTLE EGG WATCH) : MONITORING PENYU BERTELUR MENGGUNAKAN SISTEM TELEMETRY BERBASIS IOT,"Asrul S.T., M.Kom","Barsar Octariadi, S.Kom., M.Cs","Yulrio Briano M.Cs","Syf Putri Agustini Alkadri, S.T., M.Kom","Alda Cendekia Siregar, S.Kom., M.Cs"
31,2021-03-25,,,171221089,Ade Abdurrasyit,SISTEM PAKAR DIAGNOSA STUNTING PADA BALITA DENGAN MENGGUNAKAN METODE CERTAINTY FACTOR,"Aldag Keputusan Pemilihan Jurusan IPA dan IPS Untuk Siswa-Sis.Kom"
6,2020-06-08,2021-03-25,2021-03-2 M.Cs","Syf Putri Agustini Alkadri, S.T., M.Kom"
32,2021-03-25,,,171221114,Asna Fitrianti,Rancangan Bangun Multimedia Pengenalan Objek Wisata Di Daerah Kapuas Hulu Menggunakan Metode (MDLC) Multimedia Development Lift Cycle,"Sucipto, M.Kom","Syf Putri Agustini Alkadri, S.T., M.Kom","",""
33,2021-05-03,,,171220814,Isra' Pebrianti,SISTEM PENGAMBILAN KEPUTUSAN DALAM PEMILIHAN SISWA -SISWI BERPRESTASI DENGAN MENERAPKAN METODE MULTI_x0002_OBJECTIVE OPTIMALIZATIAON ON THE BASIS OF RATIOANALYSIS (MOORA) BERBASIS WEBSITE (STUDI KASUS SMAN 1 TAYAN HULU),"Syf Putri Agustini Alkadri, S.T., M.Kom","Asrul Abdullah, S.Kom., M.Cs","Sucipto, M.Kom","Barry Ceasar Octariadi, S.Kom., M.Cs"
34,2021-05-03,,,171220996,Ferry Riniadi,SISTEM PAKAR PENGOBATAN BEKAM MENGGUNAKAN METODE CASE BASE REASONING BERBASIS ANDROID,"Alda Cendekia Siregar, S.Kom., M.Cs","Rachmat Wahid Saleh Insani,ri, S.T., M.Kom","Yulrio Brianorman, S.SI., M.T","Sucipto, M.Kom171221
36,2021-05-03,,,171221115,Yovi Yulindar,RANCANGAN MEDIA INTERAKTIF MENGENAL LAGU LAGU DAERAH KALIMANTAN BARAT UNTUK ANAK ,"Sucipto, M.Kom","Yulrio Brianorman, S.SI., M.T","Rachmat Wahid Saleh Insani, S.Kom., M.Cs","Syf Putri Agustini Alkadri, S.T., M.Kom"
40,2021-06-18,,,171220372,Rizky Wahyu Prasetiyo,RANCANG BANGUN PROTOTIPE DETEKSI DINI KEBAKARAN DI RUANG ARSIP PT. MITRA MINERAL MEGATAMA MENGGUNAKAN SENSOR FLAME DETECTOR 5 CHANNEL DAN TGS-2610 BERBASIS NODEMCU TERINTEGRASI DENGAN WEB,"Alda Cendekia Siregar, S.Kom., M.Cs","Izhan Fakhruzi, ST., MSc.","Syf Putri Agustini Alkadri, S.T., M.Kom","Rachmat., M.Cs","Sucipto, M.Kom"
1221,171
41,2021-06-18,,,171220399,Giraldi Agustian,Sistem Pakar Diagnosa Penyakit Diabetes Melitus Menggunakan Metode Forward Chaining dan Backward Chaining Berbasis Website ,"Syf Putri Agustini Alkadri, S.T., M.Kom","Sucipto, M.Kom","Alda, M.Cs","Alda Cendekia Sirnorman, S.SI., M.T"
14,2020-08-27,2021-08-23,
43,2021-09-07,,,171220659,Arsita,SISTEM PAKAR DIAGNOSA PENYAKIT DAN HAMA PADA TANAMAN PEPAYAn Jenis Tanamyuran Berdasarkan   FORWARD CHAINING,"Alda Cendekia Siregar, S.Kom., M.Cs","Sucipto, M.Kom","BarrySucipto, M.Kom","Putri YulA,"Syf Putri Agustini Alkadri, S.T., M.Kom","Barr
44,2021-09-07,,,171220567,Syarif Muhammad Fariz,PERANCANGAN PINTU OTOMATIS DENGAN FINGERPRINT DAN E-KTP MENGGUNAKAN ARDUINO,"Syf Putri Agustini Alkadri, S.T., M.Kom","Asrul Abdullah, S.Kom., M.Cs","Barry Ceasar Octariadi, S.Kom., M.Cs","Rachmat Wahid Saleh Insani, S.Kom., M.Cs"
45,2021-09-07,,,171220133,Syaifullah,PENGUKUR BERAT BADAN IDEAL UNTUK BALITA DAN BATITA BERBASIS ARDUINO DENGAN SENSOR ULTRASONIC DAN LOAD CELL,"Rachmat Wahid Saleh Insani, S.Kom., M.Cs","Izhan Fakhruzi, ST., MSc.","",""
46,2021-07-23,,,171220479,Dilla Adelia,PENERAPAN METODE CERTAINTY FACTOR PADA SISTEMSAHA C UNTUKAFFE BERB HAMA DANASIS WEB DI PO TANAMAN TOMAT (Lycopersicum esculentum Mill.),"Alda Cendekia Siregar, S.Kom., M.Cs","Syfaleh Insani, S.Kom., M.Cs","AlADA RUMAH SAKIT UNTAN,"Barry Ceasar Octariad M.Cs","Sucipto, M.Kom"
47,2021-07-23,,,171220783,Asmarita,Rancang Bangun Prototype Pengusir Hama Burung Otomatis Pada Tanaman Padi Berbasis Mikrokontroler,"Asrul Abdullah, S.Kom., M.Cs","Barry Ceasar Octariadi, S.Kom., M.Cs","Sucipto,regar, S.Kom., M.Cs","Putri Yuli Utami, S. KKom., 
48,2021-09-08,,,171220578,Tiara Tri Anita,Sistem Prediksi Penjualan Lidah Buaya Dengan Metode Single Exponential Smothing Pada UPT Agribisnis ,"Syf Putri Agustini Alkadri, S.T., M.Kom","Putri1133,Hendri,SISTEM PIS PADA TANAMAN CABAI RAWIT  MENGGUNKAN M.Cs","Sucipto, M.Kom"
49,2021-09-10,,,171220493,Eka Nur Sri Wahyuni,SISTEM PAKAR PENGIDENTIFIKASI HAMA DAN PENYAKIT PADA TANAMAN ANGGREK MENGGUNAKAN METODE FORDWARD CHAINING DAN BACKWARD CHAINING,"Rachmat Wahid Saleh Insani, S.Kom., M.Cs","AldaETAAN PENDIDIKAN PERSEBARAN UNIVERSITAS DI KOTA PONTIANAK M.Cs","Barry Ceasar Octariadi, S.Kom.,,"Barr
50,2021-09-10,,,171220438,Melvin Erika Meirani Kaunang,PERBANDINGAN SISTEM PENDUKUNG KEPUTUSAN MENGGUNAKAN METODE SAW DAN METODE WP DALAM PEMBERIAN PINJAMAN DI CU. SUMBER KASIH TP. PAHAUMAN,"Barry Ceasar Octariadi, S.Kom., M.Cs","Sucipto, M.Kom","Asrul Abdullah, S.Kom., M.Cs","Alda Cendekia Siregar, S.Kom., M.Cs"
51,2021-10-29,,,182220107,Ade Zaldi Eurika Zendar ,PEMBANGUNAN APLIKASI PARIWISATA KAPUAS HULU BERBASIS ANDROID,"Syf Putri Agustini Alkadri, S.T., M.Kom","Izhan Fakhruzi, ST., MSc.","Rachmat6-10,192220086,Hapidzul Nuri M.Cs","Barry Ceasar Octariadi, S.Kom.,nadi,P
51,2021-10-29,,,171220544,Wiji Lestari Wiwik Wijayanti,IMPLEMENTASI METODE SINGLE EXPONENTIAL SMOOTHING PADA PERSEDIAAN KUE BINGKE KHATULISTIWA BERBASIS WEB,"Syf Putri Agustini Alkadri, S.T., M.Kom","Rachmat Wahid Saleh Insani, S.Kom., M.Cs","Sucipto, M.Kom","Barry Ceasar Octariadi, S.Kom., M.Cs"
51,2021-10-29,,,171220602,Ayu Nadila,PERANCANGAN SISTEM PENDETEKSI KEBAKARAN RUMAH BERBASIS ARDUINO MENGGUNAKAN SENSOR GAS MQ5 SENSOR ASAP MQ2 DAN FLAME DETECTOR 5 CHANNEL DENGAN NOTIFIKASI GATEAWAY,"Asrul Abdullah, S.Kom., M.Cs","Putri Yuli Utami, S. Kom. M.Kom","Syf Putri Agustini Alkadri, S.T., M.Kom","Rachmat Wahid Saleh Insani,m., M.Cs-05-24
51,2021-10-29,,,171220674,Novelya Vickye Tamara,PERANCANGAN SISTEM PENDETEK,171220043,Muhammad Taufiq Naufal,Pengaturan Pakan Ternak Unggas Berbasis IoT Dengan Penjadwalan Secara Otomatis Menggunakan NODEMCU ESP8266,"Rachmat Wahid Saleh Insani, S.Kom., M.Cs","Izhan Fakhruzi, ST., MSc.","Asrul Abdullah, S.Kom., M.Cs","Syf Putri Agustini Alkadri, S.T., M.Kom"
39,2021-06-18,2021-11-02,2021-11-02,171220274,Dirul Zidifaldi,PEMANFAATAN IOT SEBAGAI PENDETEKSI DINI KEBAKARAN DENGAN SENSOR API DAN SUHU MENGGUNAKAN ARDUINO,"Asrul Abdullah, S.Kom., M.Cs","Izhan Fakhruzi, ST., MSc.","Syf Putri Agustini Alkadri, S.T., M.Kom","Rachmat Wahid Saleh Insani, S.Kom., M.Cs"
42,2021-06-18,2022-06-15,2022-06-15,171220651,Wahyu Nugroho,SISTEM PAKAR DIAGNOSA HAMA DAN PENYAKIT PADI MENGGUNAKAN METODE FORWARD DAN BACKWARD CHAINING,"Rachmat Wahid Saleh Insani, S.Kom., M.Cs","Syf Putri Agustini Alkadri, S.T., M.Kom","Alda Cendekia Siregar, S.Kom., M.Cs","Asrul Abdullah, S.Kom., M.Cs"
59,2021-12-30,2023-10-24,2023-10-24,171220200,Muhammad Amin,RANCANG BANGUNG ALAT BANTU TUNA NETRA MENGGUNAKAN SENSOR ULTRASONIC HC-SR04 DAN SENSOR WATER LEVER STUDI KASUS PANTI ASUHAN AR RAHMAH PONTIANAK SELATAN,"Syf Putri Agustini Alkadri, S.T., M.Kom",Dewi Yanti,"Barry Ceasar Octariadi, S.Kom., M.Cs","Rachmat Wahid Saleh Insani, S.Kom., M.Cs"
93,2022-08-23,2023-06-06,2023-06-06,181220025,Anggi Purwanto,SISTEM INFORMASI GEOGRAFIS TOUR GUIDE PENCARIAN RUTE TERPENDEK WISATA KABUPATEN KETAPANG MENGGUNAKAN ALGORITMA DIJKSTRA,"Rachmat Wahid Saleh Insani, S.Kom., M.Cs","Barry Ceasar Octariadi, S.Kom., M.Cs","Alda Cendekia Siregar, S.Kom., M.Cs","Syf Putri Agustini Alkadri, S.T., M.Kom"
109,2022-09-16,2023-06-06,2023-06-06,191220063,Bisma Asyari,Klasifikasi Kelayakan Pemberian Kredit Menggunakan Algoritma K-Nearest Neighbor,"Syf Putri Agustini Alkadri, S.T., M.Kom","Istikoma, B.Sc., M.IT","Alda Cendekia Siregar, S.Kom., M.Cs","Asrul Abdullah, S.Kom., M.Cs"